startDate,endDate,brief,investor_id,kr_id,groupName,isCurrent,position,kr_group_id,id
2007-01-01 01:01:01,2014-01-01 01:01:01,崇德资本投资成立于2005年，是一家注册于英属开曼群岛的另类基金投资管理公司，主要针对大中华市场的多种经营项目进行投资。,570,58939,崇德投资,False,投资总监,124,620
2005-01-01 01:01:01,2007-01-01 01:01:01,"君联资本成立于2001年，联想控股总裁柳传志组建一支队伍，由朱立南率领进入投资领域，并将联想控股的3500万美元作为第一期基金，由此联想投资于2001年4月诞生。联想投资是联想控股旗下独立的专业风险投资公司。2012年2月，联想投资更名为君联资本。君联资本的核心业务定位于初创期风险投资和扩展期成长投资。
目前，君联资本共管理六期美元基金、两期人民币基金，资金规模合计逾160亿元人民币，重点投资于运作主体在中国及市场与中国相关的创新、成长型企业。
截止到2014年1月，君联资本注资企业170余家，其中23家分别在美国纽交所、纳斯达克、香港联交所、台湾柜买中心、上交所、深交所中小板和创业板上市，另有13家公司通过并购方式实现退出。",570,58939,君联资本,False,投资经理,60,621
2004-01-01 01:01:01,2005-01-01 01:01:01,北京清科投资管理有限公司成立于2009年，是由清科集团所募集成立的，专注于投资具有高增长潜质中国企业的创业投资基金。主要采取联合投资的方式和国内外著名创投机构投资于中后期企业，同时，以领投或联合领投的方式投资于早期的创业企业，投资的行业涉及互联网、移动无线应用、数字媒体、健康医疗、能源环保、消费品、服务行业及其他新兴领域。,570,58939,清科创投,False,高级投资经理,56,622
2000-01-01 01:01:01,2002-01-01 01:01:01,信息与通信解决方案供应商,570,58939,华为,False,运营,131170,623
,9999-09-09 09:09:09,专注移动互联网游戏的开发商,568,59904,乐动卓越,True,投资和并购,6063,627
2014-12-01 01:01:01,9999-09-09 09:09:09,中文搜索引擎,564,61322,百度,True,投资和并购,5204,630
2012-09-01 01:01:01,9999-09-09 09:09:09,上海起乾点坤创业投资管理合伙企业（有限合伙）成立于2011年，专注于早期的创业投资，其投资领域包括：无线互联网、新媒体（TMT） 、健康服务及环保科技等领域，以种子期和A轮投资为主。,563,61415,起点创业投资基金,True,高级投资经理,106,628
,9999-09-09 09:09:09,上海起乾点坤创业投资管理合伙企业（有限合伙）成立于2011年，专注于早期的创业投资，其投资领域包括：无线互联网、新媒体（TMT） 、健康服务及环保科技等领域，以种子期和A轮投资为主。,563,61415,起点创业投资基金,True,投资经理,106,629
2010-07-01 01:01:01,2014-08-01 01:01:01,"松禾资本管理有限公司是由深港产学研创业投资有限公司于2007年发起设立的专业化创业投资管理公司。松禾资本目前受托管理资产超过60亿元人民币,投资超过30亿元人民币，受托管企业超过100家，有23家企业成功退出（13家境内IPO与借壳上市、2家境外上市和8家被并购）。",560,62949,松禾资本,False,投资总监,204,631
2005-04-01 01:01:01,2010-03-01 01:01:01,全球著名通信企业,560,62949,北电网络,False,产品,140971,632
2002-02-01 01:01:01,2005-04-01 01:01:01,待完善,560,62949,爱立信,False,技术,130749,633
2000-07-01 01:01:01,2002-04-01 01:01:01,国内知名通信设备与技术提供商,560,62949,大唐电信,False,技术,137311,634
,9999-09-09 09:09:09,美国中经合集团成立于1993年，是一家专注于早期和扩张期企业的风险投资公司，目前管理逾7.5亿美元的基金，已投资近百家企业，在北京、台北、旧金山设有分支机构。该机构主要投资于科技、清洁技术和医疗领域的早期及扩张期企业。,557,52016,美国中经合集团,True,投资经理,118,635
2015-01-01 01:01:01,9999-09-09 09:09:09,疆域资本是一家早期的风险投资机构，主要致力于互联网与传统行业的有机结合。主要关注：旅游、社交、电商、O2O、教育、大数据、医疗、智能硬件等领域。,556,52415,疆域资本,True,分析师,1951,636
,9999-09-09 09:09:09,Cyber Agent Ventures成立于2006年，是Cyber Agent Group旗下专注于互联网与移动领域的早期风险投资机构，主要投资市场涉及日本、中国、韩国等亚洲市场。该机构于2010年在北京设立了分支机构——赛博艾坚特（北京）投资咨询有限公司。,555,52449,CA Ventures,True,投资经理,98,637
2012-08-01 01:01:01,2013-12-01 01:01:01,中国领先的互联网专业信息咨询机构,555,52449,艾瑞集团,False,市场与销售,139529,638
2014-04-01 01:01:01,9999-09-09 09:09:09,"源码资本（Source Code Capital）专注在TMT早期投资，目前管理基金共2.5亿美金，3.5亿人民币。我们集结了互联网核心层力量作为我们的出资人（红杉资本，美团网王兴，今日头条张一鸣等），他们同时会成为孤独创业者的伙伴。
创始合伙人曹毅先生在风险投资行业从业10年，专注在TMT行业，参与投资有40余家，涵盖多个细分领域：电子商务，信息平台，互联网金融，游戏娱乐、社区、O2O等。在创立源码之前，曹毅先生先后在C Square Capital、联创策源、红杉资本任职。 
专注、专业、快速、帮忙是我们面对早期阶段企业的态度和自我要求。 
源码资本是红杉资本中国成员企业。",554,52518,源码资本,True,创始合伙人,451,639
2009-04-01 01:01:01,2014-04-01 01:01:01,"红杉资本中国基金成立于2005年，截止2014年7月，已拥有7支美元基金和3支人民币基金。红杉资本创始于1972年，目前管理近30支基金。
红杉美元基金多数出资者是全球著名的教育机构和慈善机构，他们平均和红杉合作时间超过了25年；红杉人民币基金的出资者为中国的企业家、重要的科研、保险和政府机构。
红杉资本中国基金主要关注科技／传媒、医疗健康、消费品／服务和新能源／清洁技术／先进制造领域的早期和成长期企业。",554,52518,红杉资本,False,副总裁,57,640
2007-03-01 01:01:01,2008-11-01 01:01:01,联创策源投资咨询（北京）有限公司成立于2005年，是一家总部设在北京的风险投资公司，专注于投资早期的高科技企业和成长型的企业。,554,52518,策源创投,False,投资经理,59,641
,9999-09-09 09:09:09,广东文投国富股权投资基金管理有限公司成立于2014年7月，是由广东文化产业投资管理有限公司控股的合资公司，专注于移动互联网、文化创意、新媒体等产业的股权投资，致力于发现和培育中国百亿市值的企业。,552,53212,广东文投国富基金,True,投资经理,1706,643
2008-10-01 01:01:01,9999-09-09 09:09:09,中信资本控股有限公司成立于2002年，是一家主攻另类投资的投资管理及顾问公司，核心业务包括直接投资、房地产基金、结构融资、资产管理及创业投资，管理资金超过45亿美元。中信资本现有员工200多名，在香港、上海、北京、东京和纽约等地设有子公司或办事处。,551,53953,中信资本,True,投资经理,256,644
2013-01-01 01:01:01,9999-09-09 09:09:09,无锡坚果股权投资合伙企业（有限合伙）成立于2014年，致力于早期天使阶段投资，主要投资移动互联网、在线教育、在线医疗、智能硬件等。,553,52943,坚果创投,True,投资经理,1720,642
2015-05-01 01:01:01,9999-09-09 09:09:09,松树资本成立于2014年，由原新浪财经《蔡猜投资圈》嘉宾主持人创立，主要对TMT、消费零售连锁经营、医疗保健和教育、新能源、房地产等多个行业进行投资。,549,55256,松树资本,True,投资总监,460,645
2014-07-01 01:01:01,9999-09-09 09:09:09,"昆吾九鼎投资管理有限公司成立于2007年，是在国家发展与改革委员会和中国证券投资基金业协会备案登记的专注于股权投资及管理的专业机构，是中国投资协会股权和创业投资专业委员会副会长单位。在中国股权投资第三方研究机构清科集团的中国私募股权投资机构综合排名中，九鼎投资在2011年、2012年连续两年位居“中国私募股权投资机构50强”第一名，获评“中国最佳私募股权投资机构”。
九鼎投资总部位于北京，在全国50个地区设有分支机构或派驻专业人员，管理了多支人民币基金和一支美元基金。九鼎投资在消费、服务、医药医疗、农业、装备、材料、矿业、节能环保等领域均有专业的投资团队进行长期研究、跟踪，并有大量的成长期和成熟期企业的投资案例。目前，九鼎投资累计投资企业超过100家，其中已上市企业及处于上市在审企业60余家。",548,55345,九鼎投资,True,高级副总裁,400,646
,9999-09-09 09:09:09,"昆吾九鼎投资管理有限公司成立于2007年，是在国家发展与改革委员会和中国证券投资基金业协会备案登记的专注于股权投资及管理的专业机构，是中国投资协会股权和创业投资专业委员会副会长单位。在中国股权投资第三方研究机构清科集团的中国私募股权投资机构综合排名中，九鼎投资在2011年、2012年连续两年位居“中国私募股权投资机构50强”第一名，获评“中国最佳私募股权投资机构”。
九鼎投资总部位于北京，在全国50个地区设有分支机构或派驻专业人员，管理了多支人民币基金和一支美元基金。九鼎投资在消费、服务、医药医疗、农业、装备、材料、矿业、节能环保等领域均有专业的投资团队进行长期研究、跟踪，并有大量的成长期和成熟期企业的投资案例。目前，九鼎投资累计投资企业超过100家，其中已上市企业及处于上市在审企业60余家。",548,55345,九鼎投资,True,投资经理,400,647
2003-01-01 01:01:01,2012-01-01 01:01:01,待完善,548,55345,西门子中国,False,技术,131195,648
2012-06-01 01:01:01,9999-09-09 09:09:09,"中路资本成立于1998年，是上海中路（集团）有限公司旗下的股权投资平台。
上海中路（集团）有限公司，成立于1998年，是一间以投资为核心，业务范围涵盖并购产业、投资产业、影视文化和休闲文化等四个领域的集团公司。",547,55404,中路资本,True,董事,67,649
,9999-09-09 09:09:09,北京用友幸福投资管理有限公司成立于2010年，是用友软件股份有限公司旗下股权投资机构，其核心业务是信息产业股权投资与被投资企业的支持与管理，开展创投业务和PE投资业务。投资对象主要是软件及信息服务行业中具有高成长潜质的企业。投资阶段包括早期、成长期和上市前期。,545,55817,幸福投资,True,投资总监,84,650
2013-12-01 01:01:01,9999-09-09 09:09:09,帮实资本是以早期股权投资为主的基金管理公司，目前管理着四只人民币天使投资基金，总规模一亿元。基金偏好于投资TMT、信息技术、健康与消费品等行业，专业的投后团队将为企业提供财务顾问、资源整合、资本运作、团队管理等方面的一系列服务。以互联网为代表的新经济引发的创业潮和投资潮正发酵式的影响着各个行业，帮实资本会成为这股浪潮的推动者，让创新的力量引领我们走向更美好的未来。,546,55666,帮实资本,True,创始合伙人,1943,651
2011-09-01 01:01:01,9999-09-09 09:09:09,"深圳市达晨创业投资有限公司成立于2000年，总部位于深圳，是我国第一批按市场化运作设立的本土创投机构，主要聚焦于文化传媒、消费服务、现代农业及以节能环保为代表的七大战略性新兴产业等四大投资领域。
目前，达晨创投共管理15期基金，管理基金总规模超过150亿元；投资企业超过200家，成功退出48家，其中27家企业IPO，21家企业通过企业并购或回购退出。同时，已有6家企业在新三板挂牌。",542,56489,达晨创投,True,投资总监,152,652
,9999-09-09 09:09:09,"华映资本中国是一家总部位于新加坡的私募股权投资基金，一直以来专注于投资文化传媒、影视、音乐、教育、互联网、新媒体等文化领域。在新加坡、香港、上海、苏州、常熟、无锡等地设有分
支机构。
华映资本是活跃在中国市场上的，为数不多的专注于文化领域的股权投资机构。在过去的十数年间，华映管理团队的主要成员投资了30余个中国文化领域的企业，其中不乏携程、如家、新浪、好耶、分众、网龙科技、易趣、东方财富网等众多著名的行业内标杆企业。",541,56538,华映资本中国,True,投资经理,169,653
,9999-09-09 09:09:09,深圳极地信天创业投资有限公司成立于2014年，是一家致力于挖掘基于互联网的，具有颠覆性的早期创业项目的投资机构。目前基金管理规模超过3亿人民币。基金管理团队既有来自互联网行业资深从业者，也有来自长期从事风投行业的外资机构。出资人既包括上市公司、知名机构，也有经验丰富的专业投资人。,540,56580,信天创投,True,投资经理,463,654
2011-06-01 01:01:01,9999-09-09 09:09:09,软银中国资本成立于2000年，是一家致力于大中华地区投资优秀的高成长、高科技企业的私募股权投资公司，主要关注息技术、清洁技术、医疗健康、消费零售和高端制造等行业。,539,57049,软银中国资本,True,董事,71,655
2009-01-01 01:01:01,2011-06-01 01:01:01,待完善,539,57049,麦肯锡咨询公司,False,其他,131301,656
,9999-09-09 09:09:09,"浙江浙商创业投资管理集团有限公司成立于2007年，拥有70余人的专业管理团队，目前已经管理了10个VC/PE基金和1个天使基金，可投资资金规模30多亿元人民币， 管理资产规模达100亿元人民币。浙商创投的LP队伍汇集了传化集团、喜临门集团、滨江集团、 红石梁集团、惠康集团、浙江省二轻集团、杭州市金融投资集团、杭州市水泥集团、万事利集团、 青春宝集团、春风集团、美好控股集团、杭实集团等数十家著名企业和上百位成功浙商，融合本 土民营资本的力量，以“传承浙商精神，助力民族产业”为宗旨，植根浙江，拓展全国，通过股 权投资的方式，扶持一批有自主创新能力的高成长性企业在创业阶段快速突破发展瓶颈，促进民 族企业做大、做强。
浙商创投所管理的基金已成功投资华策影视（300133）、贝因美（002570）、 迪威视讯 （300167）、郑煤机（601717）、慈星股份（300307）、喜临门（603008）、华数传媒(000156)、 跃岭股份（002725）、中南卡通、东方时尚、时代华语等50多家优秀企业，涉及新媒体、现代服 务业、新能源、节能环保、装备制造、高端消费品等多个行业，扶持一批企业成长为行业龙头企 业，多个项目已经成功上市或盈利退出。2012年、2013年连续两年浙江省创投行业纳税第一。 除杭州总部，浙商创投已在北京、上海、深圳、成都、合肥、沈阳设立子公司或基金。",535,46208,浙商创投,True,投资经理,290,657
2015-01-01 01:01:01,9999-09-09 09:09:09,发现智能生活的乐趣,534,46606,乐趣,True,其他,139078,658
2012-05-01 01:01:01,2014-05-01 01:01:01,免费打车软件，无需人工电话，能高效准确的打车,534,46606,滴滴打车,False,其他,133772,659
2014-07-01 01:01:01,9999-09-09 09:09:09,"赛马资本由国内外顶级的投资团队创立，从事风险投资（Venture Capital）和私募股权投资（Private Equity）业务，为中国的优质企业提供包括风险投资、私募股权融资、企业并购和资产重组等全面的财务解决方案，帮助他们实现快速成长。
 投资领域：主要投资于TMT、移动互联网、O2O、智能硬件、智能家居、大数据、云计算等领域。",532,47505,赛马资本,True,副总裁,1975,660
2015-04-01 01:01:01,9999-09-09 09:09:09,北极光创投成立于2005年，是一家国内知名的风险投资机构。目前，旗下共管理3支美元基金和3支人民币基金，管理资产总额10亿美元。北极光创投的投资机构来自美国、欧洲和亚洲的一流大学捐赠基金、主权基金、家族基金、慈善基金以及国内最优秀的政府背景的母基金等。 北极光主要关注高科技，新媒体，通讯（TMT），清洁技术，消费及健康医疗等领域的早期和成长初期的投资公司。,531,48371,北极光创投,True,分析师,185,661
2014-10-01 01:01:01,9999-09-09 09:09:09,中美创投成立于2014年，出资人来自于中美风投和互联网界的精英人士。中美创业投资基金规模为5亿元，重点关注中美移动互联网行业，投资方向包括网络游戏、互联网广告、云计算、智能硬件、信息安全、互联网金融、社区、生活应用、电商、大数据等，主要投资目标为种子期、初创期及成长期的优秀创业公司。我们希望和梦想者携手创造全球化伟大企业。,530,48443,中美创投,True,创始合伙人,1868,662
2014-07-01 01:01:01,9999-09-09 09:09:09,GGV纪源资本是一家专注于中美两地早中期企业的风险投资，管理22亿美元规模的资本，在硅谷和上海拥有办公室。成立于2000年，GGV纪源资本构建了一个整合协作的团队，与中美两地优秀的企业家合作，共同创建行业的龙头企业。中国和美国是世界最重要的两大创新和成长经济体。 在2000年纪源资本创始伊时，GGV纪源资本的创始人发现并坚信这一发展趋势。由于GGV纪源对中美两个市场长期专注，并进行深入的本地化耕耘，从而使我们积累了独特的资源，并鼎力支持企业家在其本土和跨国的拓展业务和市场。GGV纪源致力于发现那些潜在的伟大企业家和公司，并在其成为家喻户晓的品牌之前完成战略性投资。 GGV纪源专注于早中期投资，我们支持刚进入规模化发展并需要扩展期资本帮助其实现增长的团队。诸多我们合作的企业家已创建市值超过10亿美金的公司。GGV纪源资本投资过的公司有：阿里巴巴集团、欢聚时代（纳斯达克：YY），优酷土豆（纽交所：YOKU）、去哪儿（纳斯达克：QUNR），UC优视、世纪互联（纳斯达克：VNET）、美丽说、盈盈理财、滴滴打车、潘多拉音乐（纽交所：P）、Houzz、Square、Flipboard、、Wish、Curse、今夜酒店Hotel Tonight、Nimble Storage（纽交所：NMBL）、Zendesk(纽交所：ZEN)、Grabtaxi等。,533,47179,纪源资本,True,投资经理,142,663
,9999-09-09 09:09:09,团购138是一个团购导航网站，精品团购网站大全，团购导航之家。,529,48488,团购138,True,投资和并购,16383,664
2014-05-01 01:01:01,9999-09-09 09:09:09,中美创投成立于2014年，出资人来自于中美风投和互联网界的精英人士。中美创业投资基金规模为5亿元，重点关注中美移动互联网行业，投资方向包括网络游戏、互联网广告、云计算、智能硬件、信息安全、互联网金融、社区、生活应用、电商、大数据等，主要投资目标为种子期、初创期及成长期的优秀创业公司。我们希望和梦想者携手创造全球化伟大企业。,525,49283,中美创投,True,创始合伙人,1868,665
2010-01-01 01:01:01,9999-09-09 09:09:09,深圳市鹏德创业投资有限公司成立于2010年，是一个专注于中国大陆高成长及新技术行业直接投资机会的私募基金。鹏德创业投积极寻找以能够分享并得益于中国经济高速成长优势及具行业领导地位的企业为投资对象。例如IT及互联网产业，节能环保及新能源，生物医药和医疗器械，动漫、游戏及相关新型娱乐行业，高端制造和新型服务业等。,525,49283,鹏德创投,True,副总裁,1764,666
2014-11-01 01:01:01,9999-09-09 09:09:09,"伙伴创投成立于2011年，由戴志康创办，从事创业投资，专注于以投资方式支持中国、美国早期科技类创业企业的成长。
戴志康先生及伙伴创投曾在最早期阶段投资了伙伴网、博雅互动（00434.HK）、魔漫相机、天津壳木、有利网、火币网、绿狗网、辣妈帮、在路上、MikeCRM等企业，其中很多已从10人以下企业成长为市值超过一亿美金的的中型创业企业，并有多加成功被并购或上市。",526,49225,伙伴创投,True,副总裁,644,667
2013-08-01 01:01:01,2014-10-01 01:01:01,互联网和手机安全产品及服务供应商,526,49225,奇虎360,False,投资和并购,130780,668
2011-08-01 01:01:01,2013-07-01 01:01:01,北京清科投资管理有限公司成立于2009年，是由清科集团所募集成立的，专注于投资具有高增长潜质中国企业的创业投资基金。主要采取联合投资的方式和国内外著名创投机构投资于中后期企业，同时，以领投或联合领投的方式投资于早期的创业企业，投资的行业涉及互联网、移动无线应用、数字媒体、健康医疗、能源环保、消费品、服务行业及其他新兴领域。,526,49225,清科创投,False,投资经理,56,669
2011-10-01 01:01:01,9999-09-09 09:09:09,"Korea Investment Partners Co., Ltd.成立于2000年，是Korea Investment Holdings company旗下专注于中小型企业股权投资的机构。自2000年起，主要从事创业投资业务，旗下分别管理90.73亿韩元和1亿元人民币的创业投资基金。",524,49369,韩投伙伴,True,副总裁,55,670
2012-12-01 01:01:01,9999-09-09 09:09:09,中国远镜连锁成长基金是专注于中国市场的VC/PE投资项目的股权私募基金，总部设立于北京。基金重点关注消费 品、 连锁服务、教育、医疗健康、文化产业等领域的拥有优良品牌的领先企业，主要覆盖成长期、成熟期等阶段，投资规模依照项目情况由上百万美元至上千万美元。,521,50267,远镜连锁投资,True,投资总监,695,671
2002-12-01 01:01:01,9999-09-09 09:09:09,中国领先的互联网专业信息咨询机构,520,50506,艾瑞集团,True,运营,139529,672
,9999-09-09 09:09:09,专注于早期投资和孵化,758,100392,大合投资,True,投资和并购,147855,674
2011-05-01 01:01:01,9999-09-09 09:09:09,时尚男装,757,101034,九牧王,True,投资和并购,148014,675
2014-09-01 01:01:01,9999-09-09 09:09:09,主要管理区级、省级、国家级引导基金与民间资本等组成的私募股权基金。目前旗下管理南海东方高新基金、东方联创基金、东方禅控基金、东方德昌基金、青海国科基金等五只基金，管理基金规模超过6亿元，已成功投资项目十多个。公司由阚治东先生领导的专业团队管理。,738,93616,东方汇银,True,高级投资经理,2260,673
2012-10-01 01:01:01,2014-05-01 01:01:01,负责医疗行业500强公司的反舞弊尽职调查,797,111254,KPMG,False,其他,140934,676
2014-10-01 01:01:01,9999-09-09 09:09:09,帮实资本是以早期股权投资为主的基金管理公司，目前管理着四只人民币天使投资基金，总规模一亿元。基金偏好于投资TMT、信息技术、健康与消费品等行业，专业的投后团队将为企业提供财务顾问、资源整合、资本运作、团队管理等方面的一系列服务。以互联网为代表的新经济引发的创业潮和投资潮正发酵式的影响着各个行业，帮实资本会成为这股浪潮的推动者，让创新的力量引领我们走向更美好的未来。,798,110315,帮实资本,True,合伙人,1943,677
2014-10-01 01:01:01,9999-09-09 09:09:09,北京磐谷创业投资有限责任公司是一家专注于投资中国新兴产业的私人股权投资公司，公司以磐谷资本为管理平台组建了多家项目投资公司，分别是：上海卡日曲投资有限公司、天津执象股权投资基金合伙企业（有限合伙）、天津和悦谷雨股权投资基金合伙企业（有限合伙）、天津和易谷雨股权投资合伙企业（有限合伙）。,857,127756,磐谷创投,True,投资经理,1892,678
2013-11-01 01:01:01,2014-10-01 01:01:01,待完善,857,127756,国泰君安证券股份有限公司,False,技术,131555,679
2014-09-01 01:01:01,9999-09-09 09:09:09,BiuBiu是一款海外华人社交软件，目前开放英国&爱尔兰站,858,127743,BiuBiu－海外生活,True,市场与销售,151745,680
2015-04-01 01:01:01,9999-09-09 09:09:09,上海复励投资管理有限公司2014年4月成立于中国上海，是由投资行业内外、多元化的专家组成的管理团队。团队成员均毕业于国内外著名高校，由上市公司企业家、知名投资专家和行业专家等组成。团队成员在战略管理、金融咨询、产业投资、实业经营和资产管理等方面经验丰富。团队成员既有来自实业管理经验丰富的上市公司企业家、也有上市公司互联网专家和教授，及一群管理经验丰富、顶尖学府工商管理专业毕业的基金管理人，可以说整个团队目标就是为实现价值投资理念。,897,133889,复励投资,True,投资总监,2313,681
2013-07-01 01:01:01,9999-09-09 09:09:09,教育科技企业,892,137128,好未来教育科技集团,True,投资和并购,130819,682
