startDate,endDate,brief,investor_id,kr_id,groupName,isCurrent,position,kr_group_id,id
2013-03-01 01:01:01,9999-09-09 09:09:09,"丰厚投资管理（北京）有限公司成立于2012年，由谭群钊（前盛大集团总裁）、杨守彬（知名创业者与投资人）、岳弢（巨人网络联合创始人）、吴智勇（资深投资专家）四人联合创立， 在北京和上海两地设立办公室，专注于基于互联网的“大消费、泛娱乐、金融创新”相关领域的早期投资。
丰厚资本聚集了约40位LP（有限合伙人），主要包括四类人：上市公司创始人、知名互联网公司的高管、国际金融机构中国区高管或负责人、著名传媒人士，丰富的LP资源为创业者带来更多资源分享和合作。",19,65611,丰厚资本,True,创始合伙人,633,1
,9999-09-09 09:09:09,"DCM资本成立于1996年，DCM资本是一家风险投资公司，管理着超过25亿美元的资金。从 1996 年以来，在美国和亚洲地区已投资超过200家高科技企业。
该机构主要投资于移动技术、消费者互联网、软件与服务领域的种子期、早期和中期的创业公司。",240,1809,DCM资本,True,投资经理,122,2
,9999-09-09 09:09:09,"深圳市创新投资集团是以资本为主要联结纽带的母子公司为主体的大型投资企业集团，于2002年10月正式成立。集团核心企业——深圳市创新投资集团有限公司的前身为1999年8月26日成立的深圳市创新科技投资有限公司。该机构目前管理资本量约250亿元人民币。
该公司主营业务包括：创业投资、股权投资与增值服务，主要关注制造业、高科技行业，还同时关注服务业、物流业等具有创新特质的领域。",240,1809,深创投,True,投资经理,163,3
2014-04-01 01:01:01,9999-09-09 09:09:09,执一资本Yi Capital成立于2015年，是一家新成立的美元投资机构，首期规模2亿美元，专注于TMT产业互联网领域的早期、成长期投资，关注领域覆盖汽车、金融、教育、医疗、房产服务等。,280,12442,执一资本,True,投资经理,1595,7
2013-08-01 01:01:01,2015-04-01 01:01:01,中文搜索引擎,280,12442,百度,False,投资和并购,5204,8
2011-04-01 01:01:01,9999-09-09 09:09:09,赛富亚洲基金成立于2001年，原名为软银赛富基金，目前管理约40亿美元的基金，包括旗下四期美元基金及若干人民币基金，是亚洲最大的风险投资和成长期企业投资基金之一。该机构主要关注消费、信息技术和网络媒体等领域。,199,540,赛富投资基金,True,投资经理,133,5
2006-07-01 01:01:01,2009-12-01 01:01:01,待完善,199,540,麦肯锡咨询公司,False,产品,131301,6
,9999-09-09 09:09:09,"经纬中国成立于2008年，是一家专注环保技术、教育、能源、金融服务、健康、互联网和软件行业等不同领域的投资公司。
经纬创投于1977年在美国波士顿创立，当时名为Hellman Ferri 投资公司，这是在美国东海岸设立的专注于初创型高科技公司投资的最早一批风险投资公司之一。这家公司是Apollo Computer、Stratus Computer和Continental Cable（Comcast的前身）最早的投资人，同时公司也是苹果电脑早期的投资人之一。
1982年Paul Ferri将公司更名为经纬创投，并在西海岸开设了硅谷办公室。美国的东西海岸是美国国内最重要的技术创新发源地，而当时仅有很少的几家风险投资公司同时在东西海岸设立办公室。经纬创投正是凭借这样的优势，常常能在第一时间接触到各个行业内最前端的技术创新。
2006年，经纬创投筹集了首期印度基金，这笔基金由两位管理合伙人Avnish Bajaj 和Rishi Navani共同管理。该基金总部设在孟买，已经在一系列以消费者为导向的行业中完成了若干投资项目，其投资范畴涵盖了互联网、教育、金融服务和零售业等行业。
经纬中国则是在2008年创立的，由邵亦波、徐传陞和张颖三位管理合伙人共同管理。经纬中国在环保技术、教育、能源、金融服务、健康、互联网和软件行业等不同领域积极寻找投资机会。",200,524,经纬中国,True,投资经理,48,9
2008-11-01 01:01:01,2012-02-01 01:01:01,中文搜索引擎,200,524,百度,False,产品,5204,10
,9999-09-09 09:09:09,杭州天湾投资管理有限公司成立于2010年，是由庞小伟先生联合实力雄厚的财团法人等在中国杭州发起设立的主要专注于互联网的天使投资基金。天使湾目前直接管理的风险投资基金是“天使湾1号”、“天使湾2号”、“天使湾3号”和“天使湾4号”。,279,12496,天使湾创投,True,投资经理,54,11
2010-10-01 01:01:01,9999-09-09 09:09:09,蓝驰创投成立于1998年，是一家专注早期阶段企业的领先国际风险投资公司，管理超过10亿美元总资本，重点关注互联网服务/IT、移动通讯、半导体、节能与环保领域。作为一个环球基金， 蓝驰在北京、上海、美国硅谷，首尔设有分支机构。,239,1867,蓝驰创投,True,投资总监,37,4
2012-11-01 01:01:01,9999-09-09 09:09:09,"云天使基金是一只专注于云计算和移动互联网行业方向天使期美元投资基金，由宽带资本、红杉资本、北极光创投、金沙江创投和合疏资本共同发起创立。
云天使基金致力于中国云计算及移动互联网产业的发展，主要关注这些行业种子期的技术和商业模式。发现、培育和扶持创造性的思想，创新的技术和创业的团队。云天使基金将借助自身深厚的行业背景及丰富的投融资渠道，为云计算和移动互联网行业的早期创业公司提供多重的企业发展支持，与投资的创业团队共同成长、发展和壮大。
云天使基金拥有一支独特的管理团队，由宽带资本、红杉资本、北极光创投和金沙江创投的投资专家组成。管理团队成员各自在行业经验、专业知识等方面优势互补，同时又能汇聚上述基金的其他资源和能力，从而奠定了云天使基金在企业发展战略、运营管理及股权融资方面为创业公司提供增值服务及价值创造的基础。",277,14789,云天使基金,True,投资总监,237,12
2013-06-01 01:01:01,9999-09-09 09:09:09,"深圳市达晨创业投资有限公司成立于2000年，总部位于深圳，是我国第一批按市场化运作设立的本土创投机构，主要聚焦于文化传媒、消费服务、现代农业及以节能环保为代表的七大战略性新兴产业等四大投资领域。
目前，达晨创投共管理15期基金，管理基金总规模超过150亿元；投资企业超过200家，成功退出48家，其中27家企业IPO，21家企业通过企业并购或回购退出。同时，已有6家企业在新三板挂牌。",278,14660,达晨创投,True,高级投资经理,152,13
2011-06-01 01:01:01,2013-06-01 01:01:01,海西最大的投资机构，由国家开发投资公司、台湾富邦金控和福建省投资集团共同组建，投资了中石油混改、光大银行、信达资本等案例。海峡汇富产业投资基金管理有限公司成立于2010年7月28日，注册资本1亿元人民币，是国家发改委批复下海峡两岸首支产业投资基金的管理公司；同时也是中国证券投资基金业协会获准开展私募股权投资、创业投资等私募基金业务的合法金融机构；截至2014年底，基金承诺管理总规模达328亿元。,278,14660,海峡产业投资基金,False,高级分析师,1704,14
2015-03-01 01:01:01,9999-09-09 09:09:09,互联网创业平台,317,388,36氪,True,产品,1515,15
2014-12-01 01:01:01,9999-09-09 09:09:09,互联网创业平台,316,393,36氪,True,技术,1515,16
2014-05-01 01:01:01,2014-12-01 01:01:01,实名制SNS社交网络,316,393,人人网,False,技术,4916,17
2011-05-01 01:01:01,2013-05-01 01:01:01,一个社会化招聘网站及职业社交网络，北京大杰致远信息技术有限公司旗下。,316,393,大街网,False,技术,4414,18
2014-12-01 01:01:01,9999-09-09 09:09:09,互联网创业平台,314,404,36氪,True,技术,1515,19
2014-06-01 01:01:01,2014-12-01 01:01:01,实名制SNS社交网络,314,404,人人网,False,技术,4916,20
2011-02-01 01:01:01,2014-04-01 01:01:01,待完善,314,404,广联达软件股份有限公司,False,技术,130837,21
2014-12-01 01:01:01,9999-09-09 09:09:09,互联网创业平台,311,496,36氪,True,技术,1515,22
2014-03-01 01:01:01,2014-12-01 01:01:01,实名制SNS社交网络,311,496,人人网,False,技术,4916,23
2013-09-01 01:01:01,2014-03-01 01:01:01,大数据驱动的招聘解决方案,311,496,尚格德塔,False,技术,131638,24
2015-01-01 01:01:01,9999-09-09 09:09:09,互联网创业平台,312,471,36氪,True,产品,1515,25
2014-02-01 01:01:01,2015-01-01 01:01:01,实名制SNS社交网络,312,471,人人网,False,产品,4916,26
2013-10-01 01:01:01,9999-09-09 09:09:09,互联网创业平台,308,593,36氪,True,运营,1515,27
2012-12-01 01:01:01,2013-09-01 01:01:01,中文搜索引擎,308,593,百度,False,运营,5204,28
2011-08-01 01:01:01,2012-11-01 01:01:01,综合性B2B、B2C网上商城,308,593,阿里巴巴,False,运营,5137,29
2014-09-01 01:01:01,9999-09-09 09:09:09,最专业的金融招聘培训平台,309,567,职业梦,True,其他,29878,30
2010-06-01 01:01:01,2010-08-01 01:01:01,待完善,309,567,德意志银行,False,其他,131371,31
,9999-09-09 09:09:09,"华创资本是一家为创业者提供初创期和成长期投资的专业投资机构。自2006年成立伊始，一直专注于金融服务、企业软件和服务，以及消费升级领域的早期投资，并利用深厚的资源与经验帮助所投企业进行战略规划、业务拓展和团队组建。

华创资本的早期投资金额从5万美元到30万美元，获得企业2%~20%的股权，并且会对其中的佼佼者继续增持到150万美元到200万美元。 华创资本目前管理着3000多万美元和1亿多人民币。除了资金方面的支持外，华创资本还提供企业成长所需的策略咨询、业务拓展、团队建设以及后续融资服务。",303,783,华创资本,True,投资经理,123,32
2011-11-01 01:01:01,9999-09-09 09:09:09,北京磐谷创业投资有限责任公司是一家专注于投资中国新兴产业的私人股权投资公司，公司以磐谷资本为管理平台组建了多家项目投资公司，分别是：上海卡日曲投资有限公司、天津执象股权投资基金合伙企业（有限合伙）、天津和悦谷雨股权投资基金合伙企业（有限合伙）、天津和易谷雨股权投资合伙企业（有限合伙）。,20,65540,磐谷创投,True,创始合伙人,1892,33
2013-12-01 01:01:01,9999-09-09 09:09:09,"北京东方弘道资产管理有限责任公司成立于2010年，专注于互联网行业创业公司A轮、Pre-A轮及天使轮融资，现已完成管理“弘合一期”、“弘合二期”各6000万人民币投资。2.8亿人民币规模的“弘合三期”投资基金以及，与3W咖啡合伙的天使投资基金“三万弘合”现正在投资进行中。
机构主要专注于专注于互联网金融、O2O和大数据商业应用等领域投资，投资项目包括人人贷，3W咖啡，拉勾网及天使汇等。",306,700,东方弘道,True,投资经理,386,34
2014-09-01 01:01:01,9999-09-09 09:09:09,海纳亚洲创投基金是海纳国际集团（SIG）的全资子公司，SIG授权SAI利用其自有资金在中国境内进行风险投资和私募股权投资等活动，特别关注消费类，服务类，以及数字媒体方面的企业。,300,39716,海纳亚洲,True,副总裁,350,35
2012-11-01 01:01:01,2014-09-01 01:01:01,联创策源投资咨询（北京）有限公司成立于2005年，是一家总部设在北京的风险投资公司，专注于投资早期的高科技企业和成长型的企业。,300,39716,策源创投,False,副总裁,59,36
2010-06-01 01:01:01,2012-10-01 01:01:01,北京清科投资管理有限公司成立于2009年，是由清科集团所募集成立的，专注于投资具有高增长潜质中国企业的创业投资基金。主要采取联合投资的方式和国内外著名创投机构投资于中后期企业，同时，以领投或联合领投的方式投资于早期的创业企业，投资的行业涉及互联网、移动无线应用、数字媒体、健康医疗、能源环保、消费品、服务行业及其他新兴领域。,300,39716,清科创投,False,投资总监,56,37
2014-11-01 01:01:01,9999-09-09 09:09:09,"红杉资本中国基金成立于2005年，截止2014年7月，已拥有7支美元基金和3支人民币基金。红杉资本创始于1972年，目前管理近30支基金。
红杉美元基金多数出资者是全球著名的教育机构和慈善机构，他们平均和红杉合作时间超过了25年；红杉人民币基金的出资者为中国的企业家、重要的科研、保险和政府机构。
红杉资本中国基金主要关注科技／传媒、医疗健康、消费品／服务和新能源／清洁技术／先进制造领域的早期和成长期企业。",298,42301,红杉资本,True,投资经理,57,40
,9999-09-09 09:09:09,P2P信用贷款服务平台，提供财富管理和小额贷款等服务,298,42301,宜信,True,投资和并购,3380,41
2011-01-01 01:01:01,2014-10-01 01:01:01,"华创资本是一家为创业者提供初创期和成长期投资的专业投资机构。自2006年成立伊始，一直专注于金融服务、企业软件和服务，以及消费升级领域的早期投资，并利用深厚的资源与经验帮助所投企业进行战略规划、业务拓展和团队组建。

华创资本的早期投资金额从5万美元到30万美元，获得企业2%~20%的股权，并且会对其中的佼佼者继续增持到150万美元到200万美元。 华创资本目前管理着3000多万美元和1亿多人民币。除了资金方面的支持外，华创资本还提供企业成长所需的策略咨询、业务拓展、团队建设以及后续融资服务。",298,42301,华创资本,False,投资经理,123,42
2011-01-01 01:01:01,2014-06-01 01:01:01,P2P信用贷款服务平台，提供财富管理和小额贷款等服务,298,42301,宜信,False,产品,3380,43
2010-09-01 01:01:01,9999-09-09 09:09:09,"经纬中国成立于2008年，是一家专注环保技术、教育、能源、金融服务、健康、互联网和软件行业等不同领域的投资公司。
经纬创投于1977年在美国波士顿创立，当时名为Hellman Ferri 投资公司，这是在美国东海岸设立的专注于初创型高科技公司投资的最早一批风险投资公司之一。这家公司是Apollo Computer、Stratus Computer和Continental Cable（Comcast的前身）最早的投资人，同时公司也是苹果电脑早期的投资人之一。
1982年Paul Ferri将公司更名为经纬创投，并在西海岸开设了硅谷办公室。美国的东西海岸是美国国内最重要的技术创新发源地，而当时仅有很少的几家风险投资公司同时在东西海岸设立办公室。经纬创投正是凭借这样的优势，常常能在第一时间接触到各个行业内最前端的技术创新。
2006年，经纬创投筹集了首期印度基金，这笔基金由两位管理合伙人Avnish Bajaj 和Rishi Navani共同管理。该基金总部设在孟买，已经在一系列以消费者为导向的行业中完成了若干投资项目，其投资范畴涵盖了互联网、教育、金融服务和零售业等行业。
经纬中国则是在2008年创立的，由邵亦波、徐传陞和张颖三位管理合伙人共同管理。经纬中国在环保技术、教育、能源、金融服务、健康、互联网和软件行业等不同领域积极寻找投资机会。",297,42320,经纬中国,True,合伙人,48,44
2015-08-01 01:01:01,9999-09-09 09:09:09,"IDG资本专注于与中国市场有关的VC/PE投资项目，在香港、北京、上海、广州、深圳等地设有办事处。
IDG资本重点关注消费品、连锁服务、互联网及无线应用、新媒体、教育、医疗健康、新能源、先进制造等领域的拥有一流品牌的领先企业，覆盖初创期、成长期、成熟期、Pre-IPO各个阶段，投资规模从上百万美元到上千万美元不等。
自1992年开始，作为最早进入中国市场的国际投资机构之一，IDG资本已投资包括百度、搜狐、腾讯、搜房、携程、汉庭、如家、金蝶、物美、康辉、九安等200家优秀企业，并已有超过60家企业在美国、中国香港、中国A股证券市场上市。",299,41793,IDG资本,True,投资经理,94,38
2014-10-01 01:01:01,2015-08-01 01:01:01,"IDG资本专注于与中国市场有关的VC/PE投资项目，在香港、北京、上海、广州、深圳等地设有办事处。
IDG资本重点关注消费品、连锁服务、互联网及无线应用、新媒体、教育、医疗健康、新能源、先进制造等领域的拥有一流品牌的领先企业，覆盖初创期、成长期、成熟期、Pre-IPO各个阶段，投资规模从上百万美元到上千万美元不等。
自1992年开始，作为最早进入中国市场的国际投资机构之一，IDG资本已投资包括百度、搜狐、腾讯、搜房、携程、汉庭、如家、金蝶、物美、康辉、九安等200家优秀企业，并已有超过60家企业在美国、中国香港、中国A股证券市场上市。",299,41793,IDG资本,False,分析师,94,39
2014-07-01 01:01:01,9999-09-09 09:09:09,"源码资本（Source Code Capital）专注在TMT早期投资，目前管理基金共2.5亿美金，3.5亿人民币。我们集结了互联网核心层力量作为我们的出资人（红杉资本，美团网王兴，今日头条张一鸣等），他们同时会成为孤独创业者的伙伴。
创始合伙人曹毅先生在风险投资行业从业10年，专注在TMT行业，参与投资有40余家，涵盖多个细分领域：电子商务，信息平台，互联网金融，游戏娱乐、社区、O2O等。在创立源码之前，曹毅先生先后在C Square Capital、联创策源、红杉资本任职。 
专注、专业、快速、帮忙是我们面对早期阶段企业的态度和自我要求。 
源码资本是红杉资本中国成员企业。",295,45163,源码资本,True,投资经理,451,45
2013-08-01 01:01:01,2014-07-01 01:01:01,"汉能投资成立于2003年，目前管理着一支人民币基金和一支美元基金，同时与Translink Capital美国硅谷的风险投资公司共同管理着一支美元基金； 与中国通用技术集团共同发起了一只环境产业基金；与中国知名房地产上市公司—万通控股、西咸新区发展集团有限公司等共同成立了西咸立体城市发展基金。
基金现阶段主要关注以下几方面：
1、重点关注具有独特定位和高增长的潜力行业，如TMT、媒体、消费品、清洁能源，医疗健康和服务业等；
2、重点关注可以通过整合并购方式进行快速扩展的企业。
在被投企业的选择过程中，该机构仍倾向于投资处在不同发展阶段、具有以下特征的企业：
1、广阔的市场机遇；
2、可以通过整合并购方式进行快速扩张的潜力；
3、行业领导力和切实的执行力的管理团队；
4、可持续增长的利润空间和市场份额以及良好的盈利模式。",295,45163,汉能投资,False,投资经理,136,46
2011-10-01 01:01:01,2013-07-01 01:01:01,"启迪创业投资管理（北京）有限公司成立于2001年，起源于清华科技园的企业孵化和创业投资业务实践。自1999年清华科技园创立的初期，在自身还需要被孵化的时候，开始了对初创企业的投资和孵化。2001年3月，启迪创投的前身，清华科技园孵化器公司和技术资产经营公司分别成立；2007年，更名为启迪创投。从此，我们以“投资+孵化”的模式，专注于投资中国最具创新能力的高科技、高成长企业。
启迪创投依托清华大学的丰富资源，是清华产业体系中专注于创业投资的行业领先机构。在十余年的创业投资及企业孵化历史中，启迪创投从无到有，从小到大，从弱到强，已经完成对近百家创业企业的投资，并取得了丰厚的投资回报。
目前，启迪创投作为国内最大、最优秀的源自高校背景的创投基金管理机构，受托管理包括天使投资基金在内的多只人民币基金，总资产规模超过30亿元。除大学教育基金会、政府引导资金和机构投资者以外，认同启迪长期投资理念的高净值个人也加入到启迪系列基金的出资人队伍当中。
启迪创投的投资方向包括信息技术、先进制造、新材料、生命科学、清洁技术、文化传媒和现代服务业等领域，并在这些方面积累了丰富的资源和投资经验。",295,45163,启迪创投,False,投资经理,489,47
2003-02-01 01:01:01,2011-06-01 01:01:01,综合性B2B、B2C网上商城,293,45821,阿里巴巴,False,运营,5137,49
2015-05-01 01:01:01,9999-09-09 09:09:09,"丰厚投资管理（北京）有限公司成立于2012年，由谭群钊（前盛大集团总裁）、杨守彬（知名创业者与投资人）、岳弢（巨人网络联合创始人）、吴智勇（资深投资专家）四人联合创立， 在北京和上海两地设立办公室，专注于基于互联网的“大消费、泛娱乐、金融创新”相关领域的早期投资。
丰厚资本聚集了约40位LP（有限合伙人），主要包括四类人：上市公司创始人、知名互联网公司的高管、国际金融机构中国区高管或负责人、著名传媒人士，丰富的LP资源为创业者带来更多资源分享和合作。",292,46849,丰厚资本,True,副总裁,633,50
2012-07-01 01:01:01,2015-04-01 01:01:01,平安创新投资基金成立于2012年，是中国平安集团旗下投资机构，关注金融科技、消费、医疗健康、汽车等领域的创新以及移动互联网、社交网络、数据分析、人工智能等前沿技术对个人和组织的应用。,292,46849,平安创新投资,False,副总裁,164,51
,9999-09-09 09:09:09,"晨兴资本成立于1992年，是晨兴集团从事高科技风险投资的机构，主要投资于中国大陆的高科技、媒体、通讯和生命科技项目。
在中国的投资方向主要集中在医疗保健、互联网、信息服务、媒体、软件、通讯、生命科技和教育等领域，为创业企业提供种子期、早期及成长期资金，对每一家企业的初始投资额通常在五十万美元以上，并追加投资于业绩良好的已投资企业中。
晨兴创投提供的增值服务主要包括以下几个方面：1、为企业的创业、发展、财务管理、组织架构以及法律事务等提供战略性指导；2、帮助企业建立销售网络、开拓市场； 3、帮助企业寻找和培训高级管理人员； 4、提供技术、专家意见和市场调查方面的信息； 5、帮助企业与其它商家建立战略性合作关系，以取得更具有竞争力的市场地位；6、引荐其它国际国内的投资机构，为企业提供更多的融资渠道；7、在企业合并、收购、重组和上市的过程中提供帮助。",294,45606,晨兴资本,True,投资经理,630,48
2011-11-01 01:01:01,2013-12-01 01:01:01,中文搜索引擎,291,47157,百度,False,产品,5204,52
2010-06-01 01:01:01,2011-11-01 01:01:01,团购网站,291,47157,24券,False,市场与销售,143826,53
2015-01-01 01:01:01,9999-09-09 09:09:09,无穹创投成立于2014年，是一只专注于初创期投资的基金，投资方向基本是TMT以及泛娱乐，投资轮次一般是天使轮到A轮。,288,52287,无穹创投,True,合伙人,1910,56
2013-10-01 01:01:01,2014-12-01 01:01:01,旅行服务提供商，提供酒店、机票和度假等旅行产品预订服务,288,52287,艺龙旅行网,False,投资和并购,7954,57
2012-06-01 01:01:01,9999-09-09 09:09:09,"盘古基金投资管理有限公司成立于2008年，是日本私募投资机构Ant Capital Partners蚂蚁资本旗下从事中国投资业务的全资子公司，于2011年管理层收购之后开始了独立营运。盘古创富的投资范围覆盖医疗、互联网、消费、高科技、新能源等高成长领域。
测试机构分行。",289,48822,盘古创富,True,高级投资经理,358,54
2009-01-01 01:01:01,2009-12-01 01:01:01,待完善,289,48822,中信证券股份有限公司,False,投资和并购,131313,55
,9999-09-09 09:09:09,"源码资本（Source Code Capital）专注在TMT早期投资，目前管理基金共2.5亿美金，3.5亿人民币。我们集结了互联网核心层力量作为我们的出资人（红杉资本，美团网王兴，今日头条张一鸣等），他们同时会成为孤独创业者的伙伴。
创始合伙人曹毅先生在风险投资行业从业10年，专注在TMT行业，参与投资有40余家，涵盖多个细分领域：电子商务，信息平台，互联网金融，游戏娱乐、社区、O2O等。在创立源码之前，曹毅先生先后在C Square Capital、联创策源、红杉资本任职。 
专注、专业、快速、帮忙是我们面对早期阶段企业的态度和自我要求。 
源码资本是红杉资本中国成员企业。",290,48102,源码资本,True,投资经理,451,60
2012-04-01 01:01:01,9999-09-09 09:09:09,互联网综合服务提供商,286,57607,腾讯,True,投资和并购,131154,61
