startDate,endDate,brief,investor_id,kr_id,groupName,isCurrent,position,kr_group_id,id
,9999-09-09 09:09:09,"上海晨晖创业投资管理有限公司成立于2013年，是一家专注于新一代信息技术领域的风险投资机构。
公司核心团队已先后发起设立“浦软一期基金”和“浦软二期基金”，并完成了20多家企业的风险投资。公司核心团队也是国家级孵化器—上海浦软孵化器的创办者。浦软孵化器位于国家级软件产业基地、国家级软件出口基地— 上海浦东软件园，是上海市最主要的新一代信息技术创业集聚区。
 浦软基金所投资的企业都是致力于应用最新IT技术提升人类的工作效率和生活品质，具体涉及的创业方向包括芯片设计、电子商务、云计算、移动互联网、行业应用软件、嵌入式系统、文化创意等。",432,21174,晨晖创投,True,投资经理,234,467
2015-05-01 01:01:01,9999-09-09 09:09:09,险峰华兴创业投资是由华兴资本创始人包凡携手陈科屹创立，是专注互联网、移动互联网和科技类项目的早期天使投资机构。目前，险峰华兴已投资了聚美优品、找钢网、分期乐、美柚、团车网、蜜芽宝贝、墨迹天气等过百家创业企业。,431,21350,险峰华兴,True,投资经理,68,468
2013-08-01 01:01:01,2015-04-01 01:01:01,戈壁合伙人有限公司成立于2002年，是一家专注于国内新兴创新领域的风险投资公司，其主要关注包括IT、TMT和数字媒体等多个产业。,431,21350,戈壁投资,False,投资经理,47,469
2012-05-01 01:01:01,2015-01-01 01:01:01,深圳市富坤创业投资有限公司成立于2008年，目前管理着9支人民币私募股权基金，管理资金规模超过三十亿元人民币，已在金融、文化传媒、化工、医疗设备、精密制造、消费等多个行业进行了几十例投资。,430,22221,富坤创投,False,高级投资经理,656,470
,9999-09-09 09:09:09,团购网站,428,22720,美团,True,投资和并购,4865,471
2014-08-01 01:01:01,9999-09-09 09:09:09,英诺天使基金由李竹、林森、赵仕勤、王晟四位天使投资人共同发起成立，专注于互联网及移动互联网早期投资，重点关注手机游戏、在线教育、O2O、互联网金融、移动健康等领域。截止2015年1月，英诺天使基金共投资23家早期创业企业，累计投资金额超过2500万人民币。,426,23278,英诺天使基金,True,投资总监,227,472
2008-01-01 01:01:01,9999-09-09 09:09:09,戈壁合伙人有限公司成立于2002年，是一家专注于国内新兴创新领域的风险投资公司，其主要关注包括IT、TMT和数字媒体等多个产业。,434,20534,戈壁投资,True,合伙人,47,473
2003-04-01 01:01:01,2007-12-01 01:01:01,戈壁合伙人有限公司成立于2002年，是一家专注于国内新兴创新领域的风险投资公司，其主要关注包括IT、TMT和数字媒体等多个产业。,434,20534,戈壁投资,False,副总裁,47,474
2013-09-01 01:01:01,9999-09-09 09:09:09,"华映资本中国是一家总部位于新加坡的私募股权投资基金，一直以来专注于投资文化传媒、影视、音乐、教育、互联网、新媒体等文化领域。在新加坡、香港、上海、苏州、常熟、无锡等地设有分
支机构。
华映资本是活跃在中国市场上的，为数不多的专注于文化领域的股权投资机构。在过去的十数年间，华映管理团队的主要成员投资了30余个中国文化领域的企业，其中不乏携程、如家、新浪、好耶、分众、网龙科技、易趣、东方财富网等众多著名的行业内标杆企业。",425,23308,华映资本中国,True,投资经理,169,475
2014-01-01 01:01:01,9999-09-09 09:09:09,"创新工场成立于2009年，由李开复博士创立。创新工场是一家早期投资机构，同时为创业者提供全方位的创业服务。
创新工场的投资方向立足于信息产业最热门的领域：移动互联网、消费互联网、电子商务和云计算；主要涉足的投资阶段为：种子轮、天使轮和A轮，B轮会有选择的进行跟投。",424,23325,创新工场,True,分析师,110,476
,9999-09-09 09:09:09,"南京协立创业投资有限公司成立于2009年，是一家从事创业风险投资管理的专业机构，拥有遍布长三角的渠道网络，在南京、上海、杭州、苏州、无锡、常州、镇江等地均设有分支机构。协立投资遵循“价值投资”理念，以严谨务实的投资态度服务于具有高成长性的早中期企业。
协立投资的投资管理团队有来自国内、国外知名学府的人才，专业涵盖消费、电子、化工、机械、金融、新能源、新材料、医药等领域，并且团队成员在业内拥有多年的投资经验和企业管理经验。公司整合多方面资源，为创业企业提供全方位的增值服务，以帮助企业快速成长壮大。到目前已投资企业二十家，涉及医药、互联网、半导体、工业制造、消费等多个领域。

协立投资自成立以来，和国家科技部、地方政府、地方大型企业等共同组建创投基金，目前受托管理的基金已达7家，总规模近10亿元人民币。协立投资重点投资于高端装备制造、新材料、生物技术、医疗器械和消费连锁等行业。截止目前，投资总额近5亿元人民币。",423,23563,协立投资,True,投资经理,1775,477
2015-03-01 01:01:01,9999-09-09 09:09:09,银泰资本成立于1998年，是一家总部位于法国，专注于早期投资的风险投资机构。目前，在中国，银泰资本主要管理2期中国基金，致力于消费或创新型公司的投资。,325,3875,银泰资本,True,分析师,99,478
,9999-09-09 09:09:09,国际顶级奢侈品互联网媒体集团,422,23598,Luxury Insider Group,True,投资和并购,151221,479
2013-08-01 01:01:01,2014-08-01 01:01:01,中国领先的在线游戏开发和运营商,422,23598,搜狐畅游,False,产品,132500,480
2007-08-01 01:01:01,2013-08-01 01:01:01,亚洲最大的奢侈品在线媒体,422,23598,LI,False,运营,141115,481
,9999-09-09 09:09:09,"上海朗程投资管理有限公司成立于2007年，是中国首批本土专业品牌股权投资机构之一。公司始终践行“投资+服务”的专业投资理念，专注于中国民营拟上市中小企业股权投资，为中国长三角地区乃至全国多家中小型企业提供发展资金，并协助企业规范公司治理结构、共同参与发展战略决策、改善企业管理水平、提高财务绩效、策划上市，为企业提供包括资金在内的有价值资源的有效整合。

朗程资本自成立以来，受托管理了由紫江集团发起设立的紫晨投资基金在内的三期基金，并设立项目合伙企业十余家，管理资产近20亿元，高峰持有市值规模超过10亿元。

朗程资本受托管理的基金于2007-2010年底前累计投资9个项目，截止2011年底已经上市7个，位于全国本土股权投资项目成功率最高的投资公司行列；2011-2013年累计投资10个项目，截止2014年4月底已经通过并购或回购退出2个，2个项目在IPO发行审核排队中，有望在2014年底前后走向资本市场。

2015年4月，设立了上海汇付互联网金融信息服务创业股权投资中心，合伙期限为7年，其中投资期为5年，管理退出期2年，拟从事互联网金融及配套产业的创业型股权投资等业务，主要投资于处早、中期阶段，并有良好发展预期的互联网金融企业。",420,24295,朗程资本,True,投资经理,1777,482
,9999-09-09 09:09:09,"爱建信托与其他出资方签署合伙协议，各方拟共同投资3.1亿元设立上海汇付互联网金融信息服务创业股权投资中心(有限合伙)，其中爱建信托以自有资金出资2000万元，占比6.45%。除爱建信托外，该基金的主要出资人还包括汇付天下有限公司(16.29%)、文景易盛投资有限公司(16.13%)等。
上海汇付朗程创业投资管理有限公司为基金的执行事务合伙人，负责项目投资、管理及退出的方案制定和相关实施操作。
基金从事互联网金融及配套产业的创业型股权投资等业务，主要投资于处早、中期阶段，并有良好发展预期的互联网金融企业。
合伙期限为7年，其中投资期为5年，管理退出期2年。合伙期限届满的，经全体合伙人同意可延长，延长期限不超过2年。
合伙基金的首期缴付时间为2015年4月8日，按认缴额的50%缴付。剩余50%资金的交付时间，由执行事务合伙人根据投资进程提出，最迟不晚于2016年3月31日。",420,24295,汇付创投,True,投资经理,2335,483
2014-05-01 01:01:01,9999-09-09 09:09:09,"深圳天图资本管理中心（有限合伙）成立于2002年，是国内较早从事股权投资的专业机构之一，现为中国投资协会常务理事单位及该协会创业投资专业委员会副会长单位、深圳创投公会副会长单位。
天图资本专注于投资品牌消费品企业（家庭及个人消费的产品与服务），迄今为止，已投资了凤凰医院、周黑鸭、甘其食包子、95081家政、慈铭体检、贝乐英语、德州扒鸡、八马茶叶、饭扫光下饭菜、小西牛老酸奶等50余家知名消费品企业，多数是所在细分行业的领导品牌。
天图资本拥有超过30人的专业投资团队，在深圳、北京、上海三地设有办公室，是近年来国内较为活跃的股权投资机构，多次名列业内权威机构评选国内最佳消费类投资机构。天图资本目前管理着六只人民币基金，累计投资60余家企业，管理资产市值超过60亿元人民币。",597,64201,天图资本,True,投资经理,423,486
2011-05-01 01:01:01,2014-05-01 01:01:01,"中路资本成立于1998年，是上海中路（集团）有限公司旗下的股权投资平台。
上海中路（集团）有限公司，成立于1998年，是一间以投资为核心，业务范围涵盖并购产业、投资产业、影视文化和休闲文化等四个领域的集团公司。",597,64201,中路资本,False,副总裁,67,487
,9999-09-09 09:09:09,"华软投资是一家由资深的科技和金融专业人士创办的新型投资机构，专注于高速成长的中国软件及服务产业的投资和财务顾问服务。
华软投资的总部设在中国北京，拥有遍及全国科技界的资源网络，建立了完善的治理结构和广阔的合作平台。华软投资的目标是发展成为中国软件和科技业内领先的兼并收购顾问和投融资机构。",596,64216,华软投资,True,投资经理,392,488
,9999-09-09 09:09:09,北京朗玛峰创业投资管理有限公司成立于2010年，是一家关注于前期的风险投资机构，主要关注领域包括：在线教育、消费、TMT等领域。,638,71970,朗玛峰创投,True,投资经理,226,489
,9999-09-09 09:09:09,"传媒梦工场成立于2011年，是浙江日报报业集团创设的媒体创业孵化基地品牌，是专注媒体创业的中国首个传媒业孵化器。
孵化目标：包括新媒体内容提供商、新媒体渠道商和新媒体运营平台。新媒体内容提供商包含且并不限于报纸杂志、网络内容提供商；新媒体渠道商包含并不限于线上线下社区、内容聚合推送平台等；运营平台包含并不限于广告平台、新媒体数据分析平台、新媒体APP技术平台等。
定位：传媒梦工场将给予创业团队强力支持：创业团队控股；浙江日报报业集团所有的资金和资源投入以股本形式进入公司;传媒梦工场的战略合作伙伴将跟投和提供他们的资源；毕业项目可由浙江日报报业集团所属上市公司优先收购等。",637,72309,传媒梦工场,True,投资经理,368,490
,9999-09-09 09:09:09,"深圳天图资本管理中心（有限合伙）成立于2002年，是国内较早从事股权投资的专业机构之一，现为中国投资协会常务理事单位及该协会创业投资专业委员会副会长单位、深圳创投公会副会长单位。
天图资本专注于投资品牌消费品企业（家庭及个人消费的产品与服务），迄今为止，已投资了凤凰医院、周黑鸭、甘其食包子、95081家政、慈铭体检、贝乐英语、德州扒鸡、八马茶叶、饭扫光下饭菜、小西牛老酸奶等50余家知名消费品企业，多数是所在细分行业的领导品牌。
天图资本拥有超过30人的专业投资团队，在深圳、北京、上海三地设有办公室，是近年来国内较为活跃的股权投资机构，多次名列业内权威机构评选国内最佳消费类投资机构。天图资本目前管理着六只人民币基金，累计投资60余家企业，管理资产市值超过60亿元人民币。",558,51027,天图资本,True,投资经理,423,491
2006-06-01 01:01:01,9999-09-09 09:09:09,"君联资本成立于2001年，联想控股总裁柳传志组建一支队伍，由朱立南率领进入投资领域，并将联想控股的3500万美元作为第一期基金，由此联想投资于2001年4月诞生。联想投资是联想控股旗下独立的专业风险投资公司。2012年2月，联想投资更名为君联资本。君联资本的核心业务定位于初创期风险投资和扩展期成长投资。
目前，君联资本共管理六期美元基金、两期人民币基金，资金规模合计逾160亿元人民币，重点投资于运作主体在中国及市场与中国相关的创新、成长型企业。
截止到2014年1月，君联资本注资企业170余家，其中23家分别在美国纽交所、纳斯达克、香港联交所、台湾柜买中心、上交所、深交所中小板和创业板上市，另有13家公司通过并购方式实现退出。",677,83995,君联资本,True,董事总经理,60,492
,9999-09-09 09:09:09,互联网综合服务提供商,598,63824,腾讯,True,投资和并购,131154,484
,9999-09-09 09:09:09,腾讯产业共赢基金是腾讯公司按照国际惯例设立的企业创业投资平台。基金主要使命是投资产业链上的优质公司，更好地服务腾讯开放平台上用户。主要关注网络游戏、社交网络、无线互联网、电子商务以及新媒体等领域。,598,63824,腾讯产业共赢基金,True,投资经理,2452,485
2015-01-01 01:01:01,9999-09-09 09:09:09,"杭州盈动投资管理有限公司成立于2009年，是一家专业从事风险投资的管理机构。旗下拥有人民币基金五支,管理资本规模10亿元。盈开投资主要专注于早期和成长期项目的投资，投资范围集中在清洁技术、信息技术、医疗健康和消费服务四个领域中的部分行业。",678,83972,盈动投资,True,高级投资经理,92,493
2007-03-01 01:01:01,9999-09-09 09:09:09,赛富亚洲基金成立于2001年，原名为软银赛富基金，目前管理约40亿美元的基金，包括旗下四期美元基金及若干人民币基金，是亚洲最大的风险投资和成长期企业投资基金之一。该机构主要关注消费、信息技术和网络媒体等领域。,675,84433,赛富投资基金,True,董事,133,494
,9999-09-09 09:09:09,赛富亚洲基金成立于2001年，原名为软银赛富基金，目前管理约40亿美元的基金，包括旗下四期美元基金及若干人民币基金，是亚洲最大的风险投资和成长期企业投资基金之一。该机构主要关注消费、信息技术和网络媒体等领域。,675,84433,赛富投资基金,True,投资经理,133,495
2014-12-01 01:01:01,9999-09-09 09:09:09,艾瑞旗下投资基金，天使轮和A轮,674,84579,艾瑞资本,True,投资总监,2023,496
2015-02-01 01:01:01,9999-09-09 09:09:09,星瀚资本是国内一家创新、专业的风险投资机构，重点投资TMT（大数据、智能硬件、互联网金融等）、文创、消费升级等领域的早中期项目。,718,91057,星瀚资本,True,创始合伙人,2119,497
2009-09-01 01:01:01,2011-02-01 01:01:01,负责医疗行业500强公司的反舞弊尽职调查,718,91057,KPMG,False,投资和并购,140934,498
,9999-09-09 09:09:09,全国领先的创业园管理运营商，一园多点，持股孵化。,717,91201,浙江向上创业投资管理有限公司,True,投资和并购,148771,499
2012-02-01 01:01:01,2014-08-01 01:01:01,分类信息及本地生活服务网站,716,91218,58同城,False,其他,5007,500
2005-06-01 01:01:01,2010-09-01 01:01:01,中文搜索引擎,716,91218,百度,False,其他,5204,501
,9999-09-09 09:09:09,"创信宝投资成立于2009年，专注于中国本土私募股权投资领域，目前管理人民币基金规模5亿元。创信宝管理及顾问团队成员曾在知名投资机构、上市公司、券商、审计师事务所任职,具有十年以上的资产管理、创业投资、投资银行、财务审计经验, 成功运作了多项企业IPO案例。
创信宝投资致力于为中国与全球高净值个人提供专业化的资产管理服务，为其获得最优异的绝对投资回报。旗下共发起设立两只基金，首期——深圳创信宝投资企业(有限合伙)成立于2009年3月,第二期——北京创信宝投资中心(有限合伙)成立于2010年12月 ，投资领域主要涉及农业产业化及高效农业、消费行业、医疗行业及其他战略性新兴行业。以“优选行业，精选企业，慎选团队”的投资原则，专注于挖掘符合“六新两高”（新经济、新服务、新能源、新材料、新农村、新商业模式及高科技、高成长性）、持续增长能力强、团队稳定高效的潜在的行业领导者。",711,91613,创信宝投资中心,True,投资经理,2121,502
2010-06-01 01:01:01,2015-03-01 01:01:01,网易是中国领先的互联网技术公司之一，在开发互联网应用、服务及其它技术方面，网易始终保持国内业界的领先,710,91767,网易,False,市场与销售,8490,503
2010-09-01 01:01:01,9999-09-09 09:09:09,杭州天湾投资管理有限公司成立于2010年，是由庞小伟先生联合实力雄厚的财团法人等在中国杭州发起设立的主要专注于互联网的天使投资基金。天使湾目前直接管理的风险投资基金是“天使湾1号”、“天使湾2号”、“天使湾3号”和“天使湾4号”。,707,92557,天使湾创投,True,管理合伙人,54,504
2014-02-01 01:01:01,9999-09-09 09:09:09,深圳国泰君安力鼎投资管理有限公司成立于2013年，是国泰君安与力鼎投资共同成立，用于管理国泰君安力鼎股权投资基金的管理机构。,706,92695,国泰君安力鼎投资,True,投资经理,280,505
2015-06-01 01:01:01,9999-09-09 09:09:09,广东文投国富股权投资基金管理有限公司成立于2014年7月，是由广东文化产业投资管理有限公司控股的合资公司，专注于移动互联网、文化创意、新媒体等产业的股权投资，致力于发现和培育中国百亿市值的企业。,703,92812,广东文投国富基金,True,投资经理,1706,506
2013-12-01 01:01:01,2015-05-01 01:01:01,苏河汇是一家天使投资机构+孵化器，专注于互联网、移动互联网等TMT领域的早期投资。苏河汇育成计划一年举办两期（3月和9月），每期都准备数百万的资金用于投资多支创业团队。,703,92812,苏河汇,False,投资经理,205,507
2014-06-01 01:01:01,9999-09-09 09:09:09,"源码资本（Source Code Capital）专注在TMT早期投资，目前管理基金共2.5亿美金，3.5亿人民币。我们集结了互联网核心层力量作为我们的出资人（红杉资本，美团网王兴，今日头条张一鸣等），他们同时会成为孤独创业者的伙伴。
创始合伙人曹毅先生在风险投资行业从业10年，专注在TMT行业，参与投资有40余家，涵盖多个细分领域：电子商务，信息平台，互联网金融，游戏娱乐、社区、O2O等。在创立源码之前，曹毅先生先后在C Square Capital、联创策源、红杉资本任职。 
专注、专业、快速、帮忙是我们面对早期阶段企业的态度和自我要求。 
源码资本是红杉资本中国成员企业。",708,92446,源码资本,True,副总裁,451,508
2009-05-01 01:01:01,2014-06-01 01:01:01,深度观察和报道,708,92446,《商业价值》&极客公园,False,运营,146699,509
2014-10-01 01:01:01,9999-09-09 09:09:09,杭州迭代投资管理有限公司成立于2014年10月，专注于杭州互联网天使项目投资，主要关注互联网消费服务O2O和垂直社交领域处于种子轮、天使轮以及Pre-A阶段的项目。,701,93174,迭代资本,True,合伙人,1713,510
2010-04-01 01:01:01,2013-06-01 01:01:01,"杭州盈动投资管理有限公司成立于2009年，是一家专业从事风险投资的管理机构。旗下拥有人民币基金五支,管理资本规模10亿元。盈开投资主要专注于早期和成长期项目的投资，投资范围集中在清洁技术、信息技术、医疗健康和消费服务四个领域中的部分行业。",701,93174,盈动投资,False,投资总监,92,511
2015-03-01 01:01:01,9999-09-09 09:09:09,澳大利亚电信公司,538,45569,澳洲电信,True,投资和并购,131786,512
2014-12-01 01:01:01,9999-09-09 09:09:09,博派资本成立于2014年，是由一群80后投资人和资深游戏玩家创立，主要专注于移动互联网与游戏行业的投资。,700,93461,博派资本,True,副总裁,459,513
2008-05-01 01:01:01,9999-09-09 09:09:09,"上海挚信投资管理有限公司成立于2006年，是由原盛大CFO李曙君创建，专注于投资中国市场的境外投资基金管理平台，主要投资成长期和扩张期企业，行业涉及新能源、环保、新材料、消费类产品及服务、零售流通业和新媒体等。
挚信资本还负责管理规模为3亿美元的主要投资中国在海外证券市场上市公司的对冲基金，并负责管理哥伦比亚大学基金会投资于国内A股市场的1亿美元QFII额度。
挚信资本的资金主要来源于美国著名的大学基金会（如哥伦比亚大学、斯坦福大学、纽约大学等）、国际著名的投资机构（如新加坡淡马锡控股、香港嘉里集团控股等）及一些在国际资本市场具影响力的私人投资者。",697,87300,挚信资本,True,高级投资经理,210,514
,9999-09-09 09:09:09,"富达亚洲风险投资（FAV）是富达国际（Fidelity International Ltd.）旗下进行自有资产风险投资和私募股权的分支机构，主要负责富达国际在亚洲地区的风险投资业务。

FAV 专注投资于IT和医疗行业中具备高素质和高成长性的公司，并主要立足于中国市场。在香港和上海均设有办事机构，并在过去的11年中拥有投资亚太地区领先企业的成功历史。FAV主要投资于成长初期的公司，并花大量时间和精力协助公司最大可能地取得成功。投资过的企业包括阿里巴巴、华友世纪（纳斯达克代码：HRAY）、亚信集团（纳斯达克代码：ASIA）、点击科技、无锡药明康德、中国搜索和Asia Renal Care。",696,87330,富达亚洲,True,投资经理,108,515
2010-06-01 01:01:01,9999-09-09 09:09:09,启明创投成立于2006年2月，是一家中国领先的风险投资机构，在上海、北京、苏州和香港设有办公室。启明创投旗下拥有四支美元基金，三支人民币基金，资金总额超过17亿美元，专注于互联网消费、信息技术、消费者和零售业、医疗保健以及清洁能源等行业早期和成长期企业的投资。,692,87766,启明创投,True,副总裁,200,517
,9999-09-09 09:09:09,"复星昆仲资本成立于2013年4月，是复星集团旗下的产业创投基金，专注于中早期投资，主要投资领域涵盖互联网与媒体、现代服务业和清洁技术等。美元投资金额在100万-3000万美元，人民币在400万-2亿投资。

复星昆仲资本在北京、上海和深圳设有办公室，并积极寻找美金和人民币项目的投资机会。昆仲资本背靠复星集团丰富的产业和金融资源，通过整合全球的创新能力与中国的成长动力，致力于推动中国创新企业的发展。",689,88967,复星昆仲资本,True,投资经理,249,518
,9999-09-09 09:09:09,险峰华兴创业投资是由华兴资本创始人包凡携手陈科屹创立，是专注互联网、移动互联网和科技类项目的早期天使投资机构。目前，险峰华兴已投资了聚美优品、找钢网、分期乐、美柚、团车网、蜜芽宝贝、墨迹天气等过百家创业企业。,688,89469,险峰华兴,True,投资经理,68,519
