startDate,endDate,brief,investor_id,kr_id,groupName,isCurrent,position,kr_group_id,id
,9999-09-09 09:09:09,深圳市启赋资本管理有限公司成立于2013年，是由国内创业投资领域资深人士、优秀上市公司及私营企业家发起设立，专注于国内创业投资项目投资及管理的专业化股权投资机构。其现有出资人包括中国顶级机构母基金投资人、上市公司与高净值成功企业家。启赋资本已完成中国证券投资基金业协会私募投资基金管理人备案。目前，管理基金规模为5.5亿元人民币，已经投资了30家以上的VC项目。,146,212665,启赋资本,True,投资经理,421,231
,9999-09-09 09:09:09,公司主要关注TMT、生物医药、智能硬件等领域，投资阶段以早期为主。,143,214018,贵州鼎信博成投资管理有限公司,True,投资经理,2579,232
,9999-09-09 09:09:09,祥峰投资控股有限公司成立于1998年，是淡马锡集团的全资子公司，主要从事对亚太及美国地区的新兴企业及优秀的风险投资基金进行投资。祥峰投资控股有限公司属下还有家投资管理公司，即祥峰投资管理私人有限公司，专门为祥峰集团提供基金管理及发掘投资项目等服务。,136,192949,祥峰投资,True,董事,89,233
,9999-09-09 09:09:09,"新天域资本成立于2005年，是一家专注于中国市场的私募股权投资基金，着力于“转型”与“成长”两条主线，致力于为基本面良好、具有高增长潜力的企业提供转型及进一步发展的助力。重点关注具有广阔发展空间的中国二、三线地区的投资机会。
公司主要关注领域包括：中高端制造业、可替代能源、消费品与服务业和医疗健康服务业。",134,193043,新天域资本,True,副总裁,428,234
,9999-09-09 09:09:09,点亮投资管理有限公司起步于2013年，在北京、上海、武汉、深圳均有分支机构。点亮资本侧重于种子期、高速成长期的早期投资，主要专注与机器人及人工智能、智能硬件、移动互联网、移动医疗等领域；目前已成功投资的企业包括：PPTV、波奇网、友加、People Square联合创业办公社等。,132,194542,点亮资本,True,投资经理,2518,235
,9999-09-09 09:09:09,集富亚洲成立于1990年，是一家专注于亚太地区投资的风险投资机构，管理资本量约6.5亿美元，已投资超过13个国家的388个项目。,128,195883,集富亚洲,True,投资经理,132,236
,9999-09-09 09:09:09,长石资本成立于2014年4月，是一家新型天使投资基金，致力于成为对企业最友好的价值投资者，注重投后服务，为投资企业对接所需要的各种资源，专注于创建贯穿资本、政府、TMT产业、职业经理人、互联网创业者的生态圈。主要投资布局聚集传统产业的移动互联网化，互联网医疗，互联网金融。,128,195883,长石资本,True,投资经理,2001,237
2012-09-01 01:01:01,9999-09-09 09:09:09,"深圳市创新投资集团是以资本为主要联结纽带的母子公司为主体的大型投资企业集团，于2002年10月正式成立。集团核心企业——深圳市创新投资集团有限公司的前身为1999年8月26日成立的深圳市创新科技投资有限公司。该机构目前管理资本量约250亿元人民币。
该公司主营业务包括：创业投资、股权投资与增值服务，主要关注制造业、高科技行业，还同时关注服务业、物流业等具有创新特质的领域。",129,195873,深创投,True,投资经理,163,238
,9999-09-09 09:09:09,"复星昆仲资本成立于2013年4月，是复星集团旗下的产业创投基金，专注于中早期投资，主要投资领域涵盖互联网与媒体、现代服务业和清洁技术等。美元投资金额在100万-3000万美元，人民币在400万-2亿投资。

复星昆仲资本在北京、上海和深圳设有办公室，并积极寻找美金和人民币项目的投资机会。昆仲资本背靠复星集团丰富的产业和金融资源，通过整合全球的创新能力与中国的成长动力，致力于推动中国创新企业的发展。",127,196068,复星昆仲资本,True,高级投资经理,249,239
,9999-09-09 09:09:09,熊猫资本成立于2014年，是一家新成立的早期天使投资机构。,125,196705,熊猫资本,True,投资经理,2301,240
,9999-09-09 09:09:09,"真格基金成立于2006年，是由新东方教育科技（NYSE:EDU)联合创始人徐小平、王强和红杉资本中国在2011年联合成立的天使基金。徐小平先生、王强先生是中国天使投资界的先驱。2006年至2011年间，他们投资了近八十家创业公司。真格基金成立以来已与红杉资本中国共同投资了近100家创业公司。
真格基金专注于TMT行业，包括物联网、移动互联、游戏、企业软件、O2O、电子商务及教育培训等领域的种子期投资。世纪佳缘(Nasdaq: DATE)、兰亭集势(Nasdaq: LITB)、聚美优品(NYSE: JMEI)、一起作业、美乐乐、找钢网、大姨吗、51talk等多家公司已经成为真格基金投资的明星企业。",118,201532,真格基金,True,创始合伙人,209,241
,9999-09-09 09:09:09,青山资本（原华璟海纳资本）是结合本土特点和国际化视野而创立的股权投资公司，长期致力于发掘高成长的早期优质项目。自2012年成立至今，青山资本已投资一批具有高爆发潜力的创业团队，并在许多成功企业的发展过程中起到重要作用。投资领域涉及TMT、移动互联网、医疗健康、文化创意等新兴行业，是一家多元化的创业投资机构。,116,202611,青山资本,True,投资经理,2122,242
2015-07-01 01:01:01,9999-09-09 09:09:09,"青锐创投的前身上海迭代投资成立于2015年1月，是从事早期风险投资的专业机构。因遇到重名问题，于 2015年8月正式更名为青锐创投。公司总部位于上海，公司当前管理着规模为1亿人民币的一期创投基金。专注于城市服务业及与之相关的高科技领域内优秀创业企业的早期投资。

青锐创投专注于寻找处于创业初期、拥有优秀团队和创新模式的新兴企业。青锐创投的投资重点在于天使轮和 Pre-A轮,但不排除参与少数企业的 A 轮投资。青锐创投的只投资城市服务业领域和相关的高科技领域内有着创新模式和强大执行力的企业。在城市服务业的移动互联网化这条主线下，房的服务、车的服务、医疗服务、旅游服务以及基于新型电商形态的实体产品零售服务是投资重点中的重点。",112,203355,青锐创投,True,高级副总裁,1870,243
2015-07-01 01:01:01,9999-09-09 09:09:09,北极光创投成立于2005年，是一家国内知名的风险投资机构。目前，旗下共管理3支美元基金和3支人民币基金，管理资产总额10亿美元。北极光创投的投资机构来自美国、欧洲和亚洲的一流大学捐赠基金、主权基金、家族基金、慈善基金以及国内最优秀的政府背景的母基金等。 北极光主要关注高科技，新媒体，通讯（TMT），清洁技术，消费及健康医疗等领域的早期和成长初期的投资公司。,111,203535,北极光创投,True,分析师,185,244
2010-08-01 01:01:01,9999-09-09 09:09:09,GGV纪源资本是一家专注于中美两地早中期企业的风险投资，管理22亿美元规模的资本，在硅谷和上海拥有办公室。成立于2000年，GGV纪源资本构建了一个整合协作的团队，与中美两地优秀的企业家合作，共同创建行业的龙头企业。中国和美国是世界最重要的两大创新和成长经济体。 在2000年纪源资本创始伊时，GGV纪源资本的创始人发现并坚信这一发展趋势。由于GGV纪源对中美两个市场长期专注，并进行深入的本地化耕耘，从而使我们积累了独特的资源，并鼎力支持企业家在其本土和跨国的拓展业务和市场。GGV纪源致力于发现那些潜在的伟大企业家和公司，并在其成为家喻户晓的品牌之前完成战略性投资。 GGV纪源专注于早中期投资，我们支持刚进入规模化发展并需要扩展期资本帮助其实现增长的团队。诸多我们合作的企业家已创建市值超过10亿美金的公司。GGV纪源资本投资过的公司有：阿里巴巴集团、欢聚时代（纳斯达克：YY），优酷土豆（纽交所：YOKU）、去哪儿（纳斯达克：QUNR），UC优视、世纪互联（纳斯达克：VNET）、美丽说、盈盈理财、滴滴打车、潘多拉音乐（纽交所：P）、Houzz、Square、Flipboard、、Wish、Curse、今夜酒店Hotel Tonight、Nimble Storage（纽交所：NMBL）、Zendesk(纽交所：ZEN)、Grabtaxi等。,105,207262,纪源资本,True,副总裁,142,246
,9999-09-09 09:09:09,GGV纪源资本是一家专注于中美两地早中期企业的风险投资，管理22亿美元规模的资本，在硅谷和上海拥有办公室。成立于2000年，GGV纪源资本构建了一个整合协作的团队，与中美两地优秀的企业家合作，共同创建行业的龙头企业。中国和美国是世界最重要的两大创新和成长经济体。 在2000年纪源资本创始伊时，GGV纪源资本的创始人发现并坚信这一发展趋势。由于GGV纪源对中美两个市场长期专注，并进行深入的本地化耕耘，从而使我们积累了独特的资源，并鼎力支持企业家在其本土和跨国的拓展业务和市场。GGV纪源致力于发现那些潜在的伟大企业家和公司，并在其成为家喻户晓的品牌之前完成战略性投资。 GGV纪源专注于早中期投资，我们支持刚进入规模化发展并需要扩展期资本帮助其实现增长的团队。诸多我们合作的企业家已创建市值超过10亿美金的公司。GGV纪源资本投资过的公司有：阿里巴巴集团、欢聚时代（纳斯达克：YY），优酷土豆（纽交所：YOKU）、去哪儿（纳斯达克：QUNR），UC优视、世纪互联（纳斯达克：VNET）、美丽说、盈盈理财、滴滴打车、潘多拉音乐（纽交所：P）、Houzz、Square、Flipboard、、Wish、Curse、今夜酒店Hotel Tonight、Nimble Storage（纽交所：NMBL）、Zendesk(纽交所：ZEN)、Grabtaxi等。,105,207262,纪源资本,True,投资经理,142,247
2009-01-01 01:01:01,2010-08-01 01:01:01,待完善,105,207262,罗兰贝格咨询公司,False,其他,131309,248
2006-07-01 01:01:01,2008-12-01 01:01:01,全球前五管理咨询公司,105,207262,摩立特集团,False,其他,139236,249
2015-07-01 01:01:01,9999-09-09 09:09:09,明珠基金管理有限公司成立于2014年9月，注册资金10000万元是经国家工商管理总局批准成立的全国性私募基金管理机构，是中铁明珠集团从事股权投资业务的专业子公司，投资领域涵盖互联网、高新技术、新能源、金融股权、传媒等领域。第一支基金募集目标10亿元，总募集规模为50亿元。,98,197617,明珠基金,True,高级投资经理,2533,250
2000-05-01 01:01:01,2007-07-01 01:01:01,通讯领域,98,197617,西门子（中国）有限公司,False,技术,135192,251
,9999-09-09 09:09:09,宽资本是一个投资控股公司，专注向创新技术、可跨境产业及人才提供独特的孵化、投资及企业成为服务。宽资本目前持有的投资项目近30个，主要关注中国居民的智慧生活，涉及健康生活、智慧生活与绿色生活。,96,198618,宽资本,True,合伙人,2536,252
2014-01-01 01:01:01,9999-09-09 09:09:09,股权投资、上市服务、企业咨询,108,205086,吉商资本,True,投资和并购,159635,245
2015-08-01 01:01:01,9999-09-09 09:09:09,新锐TMT股权投资基金,97,197709,马赛资本,True,投资和并购,159042,253
2013-07-01 01:01:01,2015-08-01 01:01:01,地方综合新闻平台,97,197709,东方网,False,投资和并购,9234,254
2011-10-01 01:01:01,2013-06-01 01:01:01,金融大数据提供商,97,197709,wind资讯,False,投资和并购,158842,255
2006-10-01 01:01:01,2011-09-01 01:01:01,上海新锐地方门户,97,197709,新民网,False,投资和并购,159040,256
2006-06-01 01:01:01,2006-10-01 01:01:01,网易是中国领先的互联网技术公司之一，在开发互联网应用、服务及其它技术方面，网易始终保持国内业界的领先,97,197709,网易,False,运营,8490,257
,9999-09-09 09:09:09,上海支点投资管理有限公司（简称“支点投资”）是一家植根于东方哲理土壤并发展出一整套投资理论的思想型投资公司。,95,198628,支点投资,True,投资经理,2537,258
,9999-09-09 09:09:09,"青锐创投的前身上海迭代投资成立于2015年1月，是从事早期风险投资的专业机构。因遇到重名问题，于 2015年8月正式更名为青锐创投。公司总部位于上海，公司当前管理着规模为1亿人民币的一期创投基金。专注于城市服务业及与之相关的高科技领域内优秀创业企业的早期投资。

青锐创投专注于寻找处于创业初期、拥有优秀团队和创新模式的新兴企业。青锐创投的投资重点在于天使轮和 Pre-A轮,但不排除参与少数企业的 A 轮投资。青锐创投的只投资城市服务业领域和相关的高科技领域内有着创新模式和强大执行力的企业。在城市服务业的移动互联网化这条主线下，房的服务、车的服务、医疗服务、旅游服务以及基于新型电商形态的实体产品零售服务是投资重点中的重点。",92,198837,青锐创投,True,投资经理,1870,259
2015-08-01 01:01:01,9999-09-09 09:09:09,纽信创投是一个为中国高速发展的市场中处于“天使投资阶段”和“早期风险投资阶段”的创业型企业提供资金和经营管理辅导的机构，由多位成功的中国企业家联合创立。,93,198810,纽信创投,True,高级投资经理,46,260
,9999-09-09 09:09:09,大河创投成立于2014年，是一家专注于天使及A轮项目的人民币基金，重点关注O2O、消费生活、企业服务、医疗、健康等领域的项目，基金投委会成员均为百倍收益俱乐部成员。,86,199514,大河创投,True,投资经理,2553,261
2010-08-01 01:01:01,2011-09-01 01:01:01,能源、医疗、家庭、交通运输和金融等广泛领域的全球提供商,82,200205,通用电气,False,其他,156863,262
2004-06-01 01:01:01,2006-07-01 01:01:01,待完善,82,200205,摩根大通,False,投资和并购,131512,263
2012-07-01 01:01:01,2014-05-01 01:01:01,中国境内游戏开发及运营商,81,200534,九城,False,运营,5218,264
2010-01-01 01:01:01,2012-01-01 01:01:01,安卓用户垂直社区平台,81,200534,机锋网,False,运营,4420,265
,9999-09-09 09:09:09,"杭州盈动投资管理有限公司成立于2009年，是一家专业从事风险投资的管理机构。旗下拥有人民币基金五支,管理资本规模10亿元。盈开投资主要专注于早期和成长期项目的投资，投资范围集中在清洁技术、信息技术、医疗健康和消费服务四个领域中的部分行业。",78,186901,盈动投资,True,投资经理,92,266
,9999-09-09 09:09:09,江苏沿海产业投资基金是由省政府牵头，平安集团、江苏省沿海开发集团有限公司、江苏省苏豪控股集团、江苏高科技投资集团有限公司等出资成立的产业投资基金，总金额将达到100亿人民币。,73,188777,沿海资本,True,高级投资经理,2511,267
,9999-09-09 09:09:09,"华软投资是一家由资深的科技和金融专业人士创办的新型投资机构，专注于高速成长的中国软件及服务产业的投资和财务顾问服务。
华软投资的总部设在中国北京，拥有遍及全国科技界的资源网络，建立了完善的治理结构和广阔的合作平台。华软投资的目标是发展成为中国软件和科技业内领先的兼并收购顾问和投融资机构。",74,188548,华软投资,True,投资经理,392,268
,9999-09-09 09:09:09,北京起源远航投资管理有限公司成立于2011年，是关注互联网、消费、教育、医疗、清洁技术等领域的早期创业项目的天使投资基金，投资金额在10-1000万人民币之间。从2011年起，起源资本已经成功投资有过诸多案列，包括大数据、电商服务商及O2O类型的项目，其中80%的项目在投资后一年拿到了新一轮投资。,71,188804,起源资本,True,投资经理,107,269
,9999-09-09 09:09:09,北京起源远航投资管理有限公司成立于2011年，是关注互联网、消费、教育、医疗、清洁技术等领域的早期创业项目的天使投资基金，投资金额在10-1000万人民币之间。从2011年起，起源资本已经成功投资有过诸多案列，包括大数据、电商服务商及O2O类型的项目，其中80%的项目在投资后一年拿到了新一轮投资。,72,188787,起源资本,True,投资经理,107,270
,9999-09-09 09:09:09,"上海永宣创业投资管理有限公司成立于1999年，是目前国内首屈一指的风险投资管理公司。重点投资领域将是那些有着显著增长潜力并能带来高附加值的行业：IT, 高成长性技术，生物医药，高附加值的制造业。目前管理的基金规模大约为30亿美金。截至目前，已经投资了160家公司，投资额约17亿美金。其中，已有40家投资组合公司在国内或境外成功上市。",70,189012,永宣创投,True,投资总监,262,271
2011-06-01 01:01:01,9999-09-09 09:09:09,主要管理区级、省级、国家级引导基金与民间资本等组成的私募股权基金。目前旗下管理南海东方高新基金、东方联创基金、东方禅控基金、东方德昌基金、青海国科基金等五只基金，管理基金规模超过6亿元，已成功投资项目十多个。公司由阚治东先生领导的专业团队管理。,68,189132,东方汇银,True,投资总监,2260,272
,9999-09-09 09:09:09,恒泰资本（CHT Capital）成立于2014年，是一家由本土创始团队及IDG资本共同投资设立的投资管理公司，以自有资金重点关注中早期股权融资项目。除直投业务外，恒泰资本亦涉足投融资顾问业务，并以投融资平台——“投资汇”独立运营。,69,189118,恒泰资本,True,投资经理,1934,273
2014-01-01 01:01:01,9999-09-09 09:09:09,专注早期投资，体育、医疗类项目,64,191093,联科创盈,True,CEO,2108,274
2015-08-01 01:01:01,9999-09-09 09:09:09,纽信创投是一个为中国高速发展的市场中处于“天使投资阶段”和“早期风险投资阶段”的创业型企业提供资金和经营管理辅导的机构，由多位成功的中国企业家联合创立。,50,184754,纽信创投,True,投资经理,46,275
2015-05-01 01:01:01,9999-09-09 09:09:09,"深圳前海君联同创投资管理有限公司成立于2014年10月30日，注册资本1000万人民币，其经营范围包括投资管理、股权投资、投资顾问，受托资产管理，财务咨询。
目前管理丰联银泰基金，该基金主要投资于一级市场股权投资项目以及上市公司定向增发项目。",51,184705,君创资本,True,投资经理,2472,276
,9999-09-09 09:09:09,北京起源远航投资管理有限公司成立于2011年，是关注互联网、消费、教育、医疗、清洁技术等领域的早期创业项目的天使投资基金，投资金额在10-1000万人民币之间。从2011年起，起源资本已经成功投资有过诸多案列，包括大数据、电商服务商及O2O类型的项目，其中80%的项目在投资后一年拿到了新一轮投资。,41,186310,起源资本,True,投资经理,107,277
2015-05-01 01:01:01,9999-09-09 09:09:09,"深圳前海君联同创投资管理有限公司成立于2014年10月30日，注册资本1000万人民币，其经营范围包括投资管理、股权投资、投资顾问，受托资产管理，财务咨询。
目前管理丰联银泰基金，该基金主要投资于一级市场股权投资项目以及上市公司定向增发项目。",38,178484,君创资本,True,投资经理,2472,278
2011-10-01 01:01:01,9999-09-09 09:09:09,"传媒梦工场成立于2011年，是浙江日报报业集团创设的媒体创业孵化基地品牌，是专注媒体创业的中国首个传媒业孵化器。
孵化目标：包括新媒体内容提供商、新媒体渠道商和新媒体运营平台。新媒体内容提供商包含且并不限于报纸杂志、网络内容提供商；新媒体渠道商包含并不限于线上线下社区、内容聚合推送平台等；运营平台包含并不限于广告平台、新媒体数据分析平台、新媒体APP技术平台等。
定位：传媒梦工场将给予创业团队强力支持：创业团队控股；浙江日报报业集团所有的资金和资源投入以股本形式进入公司;传媒梦工场的战略合作伙伴将跟投和提供他们的资源；毕业项目可由浙江日报报业集团所属上市公司优先收购等。",31,179601,传媒梦工场,True,CEO,368,279
2015-06-01 01:01:01,9999-09-09 09:09:09,专注证券基金和股权基金运营与投资,30,179892,中联投资,True,投资和并购,157488,280
2014-09-01 01:01:01,2015-05-01 01:01:01,，投资领域涉及矿产、新能源、文化传媒、高新科技、农牧业、生物,30,179892,唐山诺宝股权投资基金,False,投资和并购,157474,281
,9999-09-09 09:09:09,成立于2007年10月，是一家以股权投资与基金管理为主的专业,28,180142,诺宝股权投资基金管理有限公司,True,投资和并购,157483,282
,9999-09-09 09:09:09,Freesvc孚睿基金成立于2015年，由IDG资本李丰所创办，是一家早期投资基金。目标规模 10 亿元人民币，采取现金出资方式募集，基金主要对全球范围内的科技、传媒和通信领域，与互联网结合的金融、教育、医疗健康领域，以及企业服务领域等的种子期和早期为主的高增长非上市企业进行股权或与股权相关的投资。,24,181872,Freesvc,True,投资经理,2535,283
,9999-09-09 09:09:09,顺为中国互联网基金（简称“顺为资本”）成立于2011年，由小米科技雷军发起设立，顺为资本创立于2011年，管理三支合计17.5亿美元的美元基金和10亿元的人民币基金。出资人来自于国际顶级投资机构，包括国际知名主权基金、家族基金、基金中的基金及大学基金会等。顺为基金重点关注中国互联网相关行业，投资方向包括但不限于移动互联网、电子商务、社交网络平台等，主要投资目标为初创期及成长期的优质创业公司。,23,182710,顺为资本,True,分析师,203,284
2014-04-01 01:01:01,9999-09-09 09:09:09,"北京国泰创业投资基金管理有限公司成立于2009年，是经北京市金融局批准的专业股权投资管理机构，是国家及北京市政府引导基金的管理机构，是中国投资协会创业投资专业委员会会员单位、北京股权投资基金协会常务理事单位、中关村创业与股权投资协会理事单位，主要投资领域为TMT，特别是在互联网金融、数字教育、数字医疗、大数据等行业。
目前共管理4支基金。其中一支是由国家、北京市两级政府出资支持的数字内容服务专项基金；基金以投资初创、早中期企业为主，主要投向北京的中小企业。",22,182735,国泰创投,True,高级投资经理,379,285
,9999-09-09 09:09:09,"歌石投资成立于2010年，主要关注TMT、资源、环境和消费等多个领域的投资，目前所管理的基金规模达10亿元人民币，未来三年规划管理的基金规模将达30亿人民币。

 歌石团队具有成功的创业经历和丰富的投资经验，团队成员曾先后投资并帮助多家公司成功上市。公司在北京、上海、深圳、天津分别设立投资运营平台，覆盖国内最具经济活力和创新能力的区域。自2010年成立至今已先后在TMT、资源、环境和消费等多个领域完成了投资。歌石投资专注于中国市场，与国内银行和证券公司等中介机构保持友好积极的合作。",338,1221,歌石投资,True,投资经理,66,286
2012-02-01 01:01:01,2013-04-01 01:01:01,关注公司领袖和领袖公司,338,1221,英才杂志,False,产品,146173,287
2010-03-01 01:01:01,2013-09-01 01:01:01,互联网综合服务提供商,337,1356,腾讯,False,技术,131154,288
2008-01-01 01:01:01,2010-03-01 01:01:01,跨国电脑科技公司，全球最大的电脑软件提供商,337,1356,微软,False,技术,10065,289
2010-07-01 01:01:01,9999-09-09 09:09:09,中文搜索引擎,336,1656,百度,True,产品,5204,290
2013-01-01 01:01:01,9999-09-09 09:09:09,北京朗玛峰创业投资管理有限公司成立于2010年，是一家关注于前期的风险投资机构，主要关注领域包括：在线教育、消费、TMT等领域。,398,11519,朗玛峰创投,True,投资经理,226,293
2014-05-01 01:01:01,9999-09-09 09:09:09,高榕资本成立于2013年，目前管理着三支美元基金和一支人民币基金，总额超过7亿美元，专注于TMT行业初创期和成长期投资。其出资人包括了数十位成功的企业家，如腾讯、百度、阿里巴巴、小米、分众传媒、搜狐、京东、唯品会等数十家知名企业的创始人，也包括了全球领先的主权基金、美国顶级高校基金、全球最知名的家族基金、欧洲的皇室基金和养老基金、全球领先的母基金、亚洲顶级母基金等机构。高榕资本的创始合伙人累计有超过40年的TMT行业投资经验，曾主导投资了多家优秀公司，包括小米科技、91助手、3G门户、土豆、DealeXtreme、IOBit、动网、雷蛇、暴风影音、蘑菇街、蓝港、吉比特、万兴软件等。,358,4926,高榕资本,True,投资经理,378,291
